{
  "schema_version": "0.1",
  "kind": "pic.klayout.drc_lite",
  "summary": {
    "status": "pass",
    "issue_count": 0,
    "error_count": 0
  },
  "issues": [],
  "metrics": {
    "ports_extracted": 12,
    "routes_extracted": 4,
    "routes_skipped_polygons": 0,
    "routes_skipped_other": 0,
    "label_parse_errors": 0
  },
  "layers": {
    "waveguide": {
      "layer": 1,
      "datatype": 0
    },
    "label": {
      "layer": 10,
      "datatype": 0
    }
  },
  "provenance": {
    "input_gds": "C:\\Users\\aksin\\Desktop\\Qutip+qskit projects\\photonstrust\\results\\e2e_smoke\\2026-02-14_19-10-27\\run_4117a61d1e8c\\layout.gds",
    "top_cell": "TOP",
    "dbu_um": 0.001
  }
}