{
  "schema_version": "0.1",
  "kind": "pic.klayout.drc_lite",
  "summary": {
    "status": "fail",
    "issue_count": 4,
    "error_count": 4
  },
  "issues": [
    {
      "rule": "min_waveguide_width_um",
      "severity": "error",
      "message": "r1: PATH width 0.45 um < min 0.5 um",
      "route_id": "r1",
      "measured_width_um": 0.45,
      "min_width_um": 0.5
    },
    {
      "rule": "min_waveguide_width_um",
      "severity": "error",
      "message": "r2: PATH width 0.45 um < min 0.5 um",
      "route_id": "r2",
      "measured_width_um": 0.45,
      "min_width_um": 0.5
    },
    {
      "rule": "min_waveguide_width_um",
      "severity": "error",
      "message": "r3: PATH width 0.45 um < min 0.5 um",
      "route_id": "r3",
      "measured_width_um": 0.45,
      "min_width_um": 0.5
    },
    {
      "rule": "min_waveguide_width_um",
      "severity": "error",
      "message": "r4: PATH width 0.45 um < min 0.5 um",
      "route_id": "r4",
      "measured_width_um": 0.45,
      "min_width_um": 0.5
    }
  ],
  "metrics": {
    "ports_extracted": 12,
    "routes_extracted": 4,
    "routes_skipped_polygons": 0,
    "routes_skipped_other": 0,
    "label_parse_errors": 0
  },
  "layers": {
    "waveguide": {
      "layer": 1,
      "datatype": 0
    },
    "label": {
      "layer": 10,
      "datatype": 0
    }
  },
  "provenance": {
    "input_gds": "C:\\Users\\aksin\\Desktop\\Qutip+qskit projects\\photonstrust\\results\\e2e_smoke\\2026-02-14_19-06-35\\run_a3497e7a8ad6\\layout.gds",
    "top_cell": "TOP",
    "dbu_um": 0.001
  }
}